{
  "action": "walk",
  "frames": 8,
  "cell_size": 512,
  "fps": 10,
  "loop": true,
  "ping_pong": false,
  "layout": {
    "columns": 4,
    "rows": 2
  },
  "events": [
    { "frame": 0, "name": "footstep_left" },
    { "frame": 4, "name": "footstep_right" }
  ],
  "sound_sync": {
    "0": "sfx_footstep",
    "4": "sfx_footstep"
  },
  "tags": ["locomotion"]
}
