{
  "action": "jump",
  "frames": 4,
  "cell_size": 512,
  "fps": 12,
  "loop": false,
  "ping_pong": false,
  "layout": {
    "columns": 2,
    "rows": 2
  },
  "events": [
    { "frame": 1, "name": "jump_apex" },
    { "frame": 3, "name": "land" }
  ],
  "sound_sync": {
    "0": "sfx_jump",
    "3": "sfx_land"
  },
  "tags": ["core", "celebration"]
}
